{
  "case_id": "coating_line_airflow_002",
  "diagnosis_status": "confirmed",
  "incident_summary": "Fan frequency drop causes dryer temperature drift and coating non-uniformity. Primary root cause: Fan inverter airflow frequency instability. Incident window: 2026-07-15T14:00:00+08:00 to 2026-07-15T14:30:00+08:00.",
  "timeline": [
    {
      "timestamp": "2026-07-15T14:04:20+08:00",
      "title": "Alarm AIR-305",
      "detail": "Warning: Fan frequency below normal operating range (status: active)",
      "severity": "warning",
      "evidence_ids": [
        "EV-001"
      ]
    },
    {
      "timestamp": "2026-07-15T14:10:00+08:00",
      "title": "fan_frequency_hz threshold violation",
      "detail": "fan_frequency_hz fell below threshold at 41.5.",
      "severity": "major",
      "evidence_ids": []
    },
    {
      "timestamp": "2026-07-15T14:10:30+08:00",
      "title": "Alarm DRY-122",
      "detail": "Major: Dryer zone 2 temperature deviation above control band (status: active)",
      "severity": "major",
      "evidence_ids": [
        "EV-002"
      ]
    },
    {
      "timestamp": "2026-07-15T14:10:45+08:00",
      "title": "Alarm DRY-110",
      "detail": "Warning: Dryer zone 1 temperature approaching upper control limit (status: active)",
      "severity": "warning",
      "evidence_ids": [
        "EV-003"
      ]
    },
    {
      "timestamp": "2026-07-15T14:12:00+08:00",
      "title": "dryer_zone_2_temp_c threshold violation",
      "detail": "dryer_zone_2_temp_c exceeded threshold at 96.0.",
      "severity": "major",
      "evidence_ids": []
    },
    {
      "timestamp": "2026-07-15T14:12:00+08:00",
      "title": "thickness_um threshold violation",
      "detail": "thickness_um exceeded threshold at 104.2.",
      "severity": "major",
      "evidence_ids": []
    },
    {
      "timestamp": "2026-07-15T14:20:10+08:00",
      "title": "Alarm QCS-318",
      "detail": "Warning: Coating thickness drift detected by inline inspection (status: active)",
      "severity": "warning",
      "evidence_ids": [
        "EV-004"
      ]
    },
    {
      "timestamp": "2026-07-15T14:26:30+08:00",
      "title": "Alarm AIR-305",
      "detail": "Warning: Fan frequency below normal operating range (status: recovered)",
      "severity": "warning",
      "evidence_ids": [
        "EV-005"
      ]
    },
    {
      "timestamp": "2026-07-15T14:28:15+08:00",
      "title": "Alarm DRY-122",
      "detail": "Major: Dryer zone 2 temperature deviation above control band (status: recovered)",
      "severity": "major",
      "evidence_ids": [
        "EV-006"
      ]
    }
  ],
  "evidence": [
    {
      "id": "EV-001",
      "source": "alarms.csv",
      "summary": "AIR-305 warning alarm: Fan frequency below normal operating range",
      "timestamp": "2026-07-15T14:04:20+08:00",
      "field": null,
      "value": "AIR-305"
    },
    {
      "id": "EV-002",
      "source": "alarms.csv",
      "summary": "DRY-122 major alarm: Dryer zone 2 temperature deviation above control band",
      "timestamp": "2026-07-15T14:10:30+08:00",
      "field": null,
      "value": "DRY-122"
    },
    {
      "id": "EV-003",
      "source": "alarms.csv",
      "summary": "DRY-110 warning alarm: Dryer zone 1 temperature approaching upper control limit",
      "timestamp": "2026-07-15T14:10:45+08:00",
      "field": null,
      "value": "DRY-110"
    },
    {
      "id": "EV-004",
      "source": "alarms.csv",
      "summary": "QCS-318 warning alarm: Coating thickness drift detected by inline inspection",
      "timestamp": "2026-07-15T14:20:10+08:00",
      "field": null,
      "value": "QCS-318"
    },
    {
      "id": "EV-005",
      "source": "alarms.csv",
      "summary": "AIR-305 warning alarm: Fan frequency below normal operating range",
      "timestamp": "2026-07-15T14:26:30+08:00",
      "field": null,
      "value": "AIR-305"
    },
    {
      "id": "EV-006",
      "source": "alarms.csv",
      "summary": "DRY-122 major alarm: Dryer zone 2 temperature deviation above control band",
      "timestamp": "2026-07-15T14:28:15+08:00",
      "field": null,
      "value": "DRY-122"
    },
    {
      "id": "EV-007",
      "source": "sensor_readings.csv",
      "summary": "dryer_zone_2_temp_c above threshold at 96.0",
      "timestamp": "2026-07-15T14:12:00+08:00",
      "field": "dryer_zone_2_temp_c",
      "value": "96.0"
    },
    {
      "id": "EV-008",
      "source": "sensor_readings.csv",
      "summary": "fan_frequency_hz below threshold at 41.5",
      "timestamp": "2026-07-15T14:10:00+08:00",
      "field": "fan_frequency_hz",
      "value": "41.5"
    },
    {
      "id": "EV-009",
      "source": "sensor_readings.csv",
      "summary": "thickness_um above threshold at 104.2",
      "timestamp": "2026-07-15T14:12:00+08:00",
      "field": "thickness_um",
      "value": "104.2"
    },
    {
      "id": "EV-010",
      "source": "sop_airflow_temperature.md",
      "summary": "SOP section 'Overview' is relevant to observed anomalies.",
      "timestamp": null,
      "field": null,
      "value": null
    },
    {
      "id": "EV-011",
      "source": "sop_airflow_temperature.md",
      "summary": "SOP section 'AIR-305 Fan Frequency Below Normal' is relevant to observed anomalies.",
      "timestamp": null,
      "field": null,
      "value": null
    },
    {
      "id": "EV-012",
      "source": "sop_airflow_temperature.md",
      "summary": "SOP section 'DRY-122 Dryer Zone Temperature Deviation' is relevant to observed anomalies.",
      "timestamp": null,
      "field": null,
      "value": null
    },
    {
      "id": "EV-013",
      "source": "sop_airflow_temperature.md",
      "summary": "SOP section 'DRY-110 Dryer Zone 1 Temperature Approaching Limit' is relevant to observed anomalies.",
      "timestamp": null,
      "field": null,
      "value": null
    },
    {
      "id": "EV-014",
      "source": "sop_airflow_temperature.md",
      "summary": "SOP section 'QCS-318 Thickness Drift' is relevant to observed anomalies.",
      "timestamp": null,
      "field": null,
      "value": null
    },
    {
      "id": "EV-015",
      "source": "maintenance_records.md",
      "summary": "Maintenance record M-2026-057: Line: cell coating line B",
      "timestamp": null,
      "field": null,
      "value": "M-2026-057"
    },
    {
      "id": "EV-016",
      "source": "maintenance_records.md",
      "summary": "Maintenance record M-2026-089: Line: cell coating line A",
      "timestamp": null,
      "field": null,
      "value": "M-2026-089"
    }
  ],
  "root_cause_candidates": [
    {
      "candidate_id": "RC-001",
      "title": "Fan inverter airflow frequency instability",
      "title_zh": "风机变频与风量频率不稳定",
      "confidence": 0.92,
      "priority": "high",
      "evidence_ids": [
        "EV-001",
        "EV-005",
        "EV-007",
        "EV-008",
        "EV-011",
        "EV-012",
        "EV-013",
        "EV-014",
        "EV-015",
        "EV-016"
      ],
      "rationale": "Matched alarm codes: AIR-305. Anomalous sensor fields: dryer_zone_2_temp_c, fan_frequency_hz. SOP sections provide relevant check procedures. Historical maintenance records show similar patterns.",
      "score_breakdown": {
        "alarm_match": 1.0,
        "sensor_correlation": 1.0,
        "sop_match": 1.0,
        "maintenance_similarity": 1.0,
        "operator_note_match": 0.2,
        "total": 0.92
      },
      "fault_mode_id": "FM-003",
      "diagnostic_role": "equipment_cause",
      "why_ranked": "Ranked from alarm 100%, sensor 100%, SOP 100%, maintenance 100%, and operator note 20% evidence.",
      "missing_evidence": []
    },
    {
      "candidate_id": "RC-002",
      "title": "Dryer zone 2 temperature control loop instability",
      "title_zh": "干燥二区温度控制回路不稳定",
      "confidence": 0.92,
      "priority": "high",
      "evidence_ids": [
        "EV-002",
        "EV-003",
        "EV-006",
        "EV-007",
        "EV-011",
        "EV-012",
        "EV-013",
        "EV-014",
        "EV-015",
        "EV-016"
      ],
      "rationale": "Matched alarm codes: DRY-110, DRY-122. Anomalous sensor fields: dryer_zone_2_temp_c. SOP sections provide relevant check procedures. Historical maintenance records show similar patterns.",
      "score_breakdown": {
        "alarm_match": 1.0,
        "sensor_correlation": 1.0,
        "sop_match": 1.0,
        "maintenance_similarity": 1.0,
        "operator_note_match": 0.174,
        "total": 0.917
      },
      "fault_mode_id": "FM-001",
      "diagnostic_role": "equipment_cause",
      "why_ranked": "Ranked from alarm 100%, sensor 100%, SOP 100%, maintenance 100%, and operator note 17% evidence.",
      "missing_evidence": []
    }
  ],
  "primary_root_cause": {
    "candidate_id": "RC-001",
    "title": "Fan inverter airflow frequency instability",
    "title_zh": "风机变频与风量频率不稳定",
    "confidence": 0.92,
    "priority": "high",
    "evidence_ids": [
      "EV-001",
      "EV-005",
      "EV-007",
      "EV-008",
      "EV-011",
      "EV-012",
      "EV-013",
      "EV-014",
      "EV-015",
      "EV-016"
    ],
    "rationale": "Matched alarm codes: AIR-305. Anomalous sensor fields: dryer_zone_2_temp_c, fan_frequency_hz. SOP sections provide relevant check procedures. Historical maintenance records show similar patterns.",
    "score_breakdown": {
      "alarm_match": 1.0,
      "sensor_correlation": 1.0,
      "sop_match": 1.0,
      "maintenance_similarity": 1.0,
      "operator_note_match": 0.2,
      "total": 0.92
    },
    "fault_mode_id": "FM-003",
    "diagnostic_role": "equipment_cause",
    "why_ranked": "Ranked from alarm 100%, sensor 100%, SOP 100%, maintenance 100%, and operator note 20% evidence.",
    "missing_evidence": []
  },
  "contributing_factors": [],
  "downstream_effects": [
    {
      "candidate_id": "RC-003",
      "title": "Coating thickness drift and yield risk",
      "title_zh": "涂层厚度漂移与良率风险",
      "confidence": 0.74,